SKU,Name1,Name2
ST20240506_072739_RESCUE ALL THE CATS,RESCUE ALL,THE CATS
ST20240506_072740_IN CASE OF EMERGENCY PLEASE RESCUE MY CATS,IN CASE OF EMERGENCY,PLEASE RESCUE MY CATS
ST20240506_072741_PROUD RESCUE CAT MOM,PROUD RESCUE,CAT MOM
ST20240506_072742_SAVE A LIFE ADOPT A CAT,SAVE A LIFE,ADOPT A CAT
ST20240506_072743_CAT MOM,CAT,MOM
ST20240506_072744_IM HERE TO PET ALL THE CATS,I'M HERE TO PET,ALL THE CATS
ST20240506_072745_IT WAS ME I LET THE CATS OUT,IT WAS ME I LET,THE CATS OUT
ST20240506_072746_LIFE IS BETTER WITH A CAT,LIFE IS BETTER,WITH A CAT
ST20240506_072747_I WORK HARD SO MY CATS CAN HAVE A BETTER LIFE,I WORK HARD SO MY CATS,CAN HAVE A BETTER LIFE
ST20240506_072748_I LOVE MY RESCUE CAT,I LOVE MY,RESCUE CAT
ST20240506_072749_CATS WELCOME PEOPLE TOLERATED,CATS WELCOME,PEOPLE TOLERATED
ST20240506_072750_TELL YOUR CAT I SAID HI,TELL YOUR CAT,I SAID HI!
ST20240506_072751_MY WINDOWS ARENT DIRTY THATS MY CATS NOSE ART,MY WINDOWS AREN'T DIRTY,THAT'S MY CAT'S NOSE ART
ST20240506_072752_CATS BECAUSE PEOPLE SUCK,CATS BECAUSE,PEOPLE SUCK
ST20240506_072753_CAT MOM CAT DAD,CAT MOM,CAT DAD
ST20240506_072754_IM ONLY TALKING TO MY CAT TODAY,I'M ONLY TALKING,TO MY CAT TODAY
ST20240506_072755_THE MORE PEOPLE I MEET THE MORE I LIKE MY CAT,THE MORE PEOPLE I MEET,THE MORE I LIKE MY CAT
ST20240506_072756_I LIKE CATS COFFEE AND MAYBE 3 PEOPLE,I LIKE CATS COFFEE,AND MAYBE 3 PEOPLE
ST20240506_072757_I LIKE CATS AND MAYBE 3 PEOPLE,I LIKE CATS AND,MAYBE 3 PEOPLE
ST20240506_072758_CAT ON BOARD,CAT ON,BOARD
ST20240506_072759_SERVICE CAT ON BOARD,SERVICE CAT,ON BOARD
ST20240506_072800_A HOUSE IS NOT A HOME WITHOUT A CAT,A HOUSE IS NOT A,HOME WITHOUT A CAT
ST20240506_072801_CAT IS NOT SPOILED IM JUST WELL TRAINED,CAT IS NOT SPOILED I'M,JUST WELL TRAINED
ST20240506_072802_CATS MAKE ME HAPPY PEOPLE NOT SO MUCH,CATS MAKE ME HAPPY!,"PEOPLE, NOT SO MUCH."
ST20240506_072803_CATS MAKE ME HAPPY YOU NOT SO MUCH,CATS MAKE ME HAPPY!,"YOU, NOT SO MUCH."
ST20240506_072804_IF MY CAT DOESNT LIKE YOU NEITHER DO I,IF MY CAT DOESN'T,LIKE YOU NEITHER DO I
ST20240506_072805_CATS MAKE ME HAPPY HUMANS MAKE MY HEAD HURT,CATS MAKE ME HAPPY,HUMANS MAKE MY HEAD HURT
ST20240506_072806_HOLD ON I SEE A CAT,HOLD ON I,SEE A CAT
ST20240506_072807_BE THE PERSON YOUR CAT THINKS YOU ARE,BE THE PERSON YOUR,CAT THINKS YOU ARE
ST20240506_072808_IF YOURE NOT THE LEAD CAT THE VIEW NEVER CHANGES,IF YOU'RE NOT THE LEAD CAT,THE VIEW NEVER CHANGES
ST20240506_072809_MY CATS AND I TALK SHIT ABOUT YOU,MY CATS AND I TALK,SHIT ABOUT YOU
ST20240506_072810_SPOILED CAT ON BOARD,SPOILED CAT,ON BOARD
