SKU,Name1,Name2
ST20240527_202447_DONT HONK AT ME IM TRYING MY BEST,DON'T HONK AT ME,I'M TRYING MY BEST
ST20240527_202448_I USED TO BE COOL,I USED TO,BE COOL
ST20240527_202449_GET BUSY LIVING OR GET BUSY DYING,GET BUSY LIVING OR,GET BUSY DYING
ST20240527_202450_IM WEIRD IM A WEIRDO,"I'M WEIRD,",I'M A WEIRDO
ST20240527_202451_EMPOWERED WOMEN EMPOWER WOMEN,EMPOWERED WOMEN,EMPOWER WOMEN
ST20240527_202452_WOULD YOU LOVE ME IF I WAS A WORM,WOULD YOU LOVE ME,IF I WAS A WORM?
ST20240527_202453_PLEASE DO NOT HIT ME IDK HOW CAR WORKS,PLEASE DO NOT HIT ME,IDK HOW CAR WORKS
ST20240527_202454_PLEASE BE PATIENT DRIVER WITH AUTISM,PLEASE BE PATIENT,DRIVER WITH AUTISM
ST20240527_202455_MEASURE ONCE CUSS TWICE,MEASURE ONCE,CUSS TWICE
ST20240527_202456_WORLDS OKAYEST DRUMMER,WORLD'S,OKAYEST DRUMMER
ST20240527_202457_DRIVER PICKS THE MUSIC SHOTGUN SHUTS HIS CAKEHOLE,"DRIVER PICKS THE MUSIC,",SHOTGUN SHUTS HIS CAKEHOLE
ST20240527_202458_IM NOT IN YOUR HURRY,I'M NOT IN,YOUR HURRY!
ST20240527_202459_COMMIT TAX FRAUD,COMMIT TAX,FRAUD
ST20240527_202500_YOU JUST GOT PASSED BY A GRANDPA,YOU JUST GOT,PASSED BY A GRANDPA
ST20240527_202501_DONT BE A DICK,DON'T BE,A DICK
ST20240527_202502_I DONT GIVE A DUCK,I DON'T GIVE,A DUCK!
ST20240527_202503_PLEASE BE PATIENT WOMAN DRIVER,PLEASE BE PATIENT,WOMAN DRIVER
ST20240527_202504_MAKE AMERICA A SHITHOLE AGAIN VOTE DEMOCRAT,MAKE AMERICA A SHITHOLE,AGAIN VOTE DEMOCRAT
ST20240527_202505_MAKE AMERICA KIND AGAIN,MAKE AMERICA,KIND AGAIN
ST20240527_202506_THICK THIGHS SAVE LIVES,THICK THIGHS,SAVE LIVES
ST20240527_202507_CARPENTER BECAUSE BADASS MIRACLE WORKER ISNT AN OFFICIAL JOB TITLE,CARPENTER BECAUSE BADASS MIRACLE,WORKER ISN'T AN OFFICIAL JOB TITLE
ST20240527_202508_REMEMBER WHO YOU ARE,REMEMBER WHO,YOU ARE
ST20240527_202509_KEEP HONKING BUDDY IM RELOADING,KEEP HONKING BUDDY,I'M RE-LOADING!
ST20240527_202510_THE CLOSER YOU GET THE SLOWER I DRIVE,THE CLOSER YOU GET,THE SLOWER I DRIVE
ST20240527_202511_PRAY MORE WORRY LESS,PRAY MORE,WORRY LESS
ST20240527_202512_DONT TOUCH MY DRONE,DON'T TOUCH,MY DRONE
ST20240527_202513_SKATEBOARDING IS NOT A CRIME,SKATEBOARDING IS,NOT A CRIME
ST20240527_202514_HUNGRY DOGS RUN FASTER,HUNGRY DOGS,RUN FASTER
ST20240527_202515_IT NEVER HURTS TO KEEP LOOKING FOR SUNSHINE,IT NEVER HURTS TO KEEP,LOOKING FOR SUNSHINE
ST20240527_202516_HONK IF YOU POOPED TODAY,HONK IF YOU,POOPED TODAY
ST20240527_202518_YOU CAN NEVER HAVE TOO MANY LAWNMOWERS,YOU CAN NEVER HAVE,TOO MANY LAWNMOWERS
ST20240527_202519_GOD SAID IT I BELIEVE IT THAT SETTLES IT,GOD SAID IT I BELIEVE,IT THAT SETTLES IT
ST20240527_202520_HUG ME IF YOU CAN,HUG ME IF,YOU CAN
ST20240527_202521_I CANT FIX STUPID BUT I CAN HELP YOU SEE IT,I CAN'T FIX STUPID BUT I,CAN HELP YOU SEE IT
ST20240527_202522_YOU CAN NEVER HAVE TOO MANY RC PLANES,YOU CAN NEVER HAVE,TOO MANY RC PLANES
ST20240527_202523_WORLDS OKAYEST SNOWBOARDER,WORLD'S OKAYEST,SNOWBOARDER
ST20240527_202524_DONT FOLLOW ME IM ABOUT TO DO A BUNCH OF STUPID,DON'T FOLLOW ME I'M ABOUT,TO DO A BUNCH OF STUPID
ST20240527_202525_IF I CANT HAVE LOVE I WANT POWER,IF I CAN'T HAVE,"LOVE, I WANT POWER"
ST20240527_202526_ELECT A CLOWN EXPECT A CIRCUS,ELECT A CLOWN,EXPECT A CIRCUS
ST20240527_202527_THESE PRETZELS ARE MAKING ME THIRSTY,THESE PRETZELS ARE,MAKING ME THIRSTY!
ST20240527_202528_WORLDS OKAYEST ACCOUNTANT,WORLD'S OKAYEST,ACCOUNTANT
ST20240527_202529_SUCK IT UP BUTTERCUP,SUCK IT UP,BUTTERCUP
ST20240527_202530_PLEASE BE PATIENT I AM GAY DRIVER,PLEASE BE PATIENT,I AM GAY DRIVER
ST20240527_202531_MY FAVORITE PEOPLE CALL ME DAD,MY FAVORITE,PEOPLE CALL ME DAD
ST20240527_202532_I WORKOUT BECAUSE PUNCHING PEOPLE IS FROWNED UPON,I WORKOUT BECAUSE PUNCHING,PEOPLE IS FROWNED UPON
ST20240527_202533_GODS CHILDREN ARE NOT FOR SALE,GOD'S CHILDREN,ARE NOT FOR SALE
ST20240527_202534_SORRY OFFICER I THOUGHT YOU WANTED TO RACE,SORRY OFFICER I THOUGHT,YOU WANTED TO RACE
ST20240527_202535_NEVER UNDERESTIMATE A GIRL WITH A HOCKEY STICK,NEVER UNDERESTIMATE A,GIRL WITH A HOCKEY STICK
ST20240527_202536_IM HERE TO LAY PIPE,I'M HERE TO,LAY PIPE!
ST20240527_202537_YOURE GOING TO REAP WHAT YOU SOW,YOU'RE GOING TO,REAP WHAT YOU SOW
ST20240527_202538_SHIT COULD BE WORSE,SHIT COULD,BE WORSE
ST20240527_202539_ONLY UGLY PEOPLE TAILGATE ME,ONLY UGLY PEOPLE,TAILGATE ME
ST20240527_202540_AT LEAST ALL THIS TRAUMA MADE ME HILARIOUS,AT LEAST ALL THIS,TRAUMA MADE ME HILARIOUS
ST20240527_202541_PERSONAL TORTURE INSTRUCTOR I MEAN PERSONAL TRAINER,PERSONAL TORTURE INSTRUCTOR,I MEAN PERSONAL TRAINER
ST20240527_202542_ITS JUST A FLESH WOUND,IT'S JUST A,FLESH WOUND
ST20240527_202543_LIFE IS SHORT AND SO AM I,LIFE IS SHORT,AND SO AM I
ST20240527_202544_WHAT GOES AROUND COMES AROUND,WHAT GOES AROUND,COMES AROUND
ST20240527_202545_IM NOT JUDGING IM ASSESSING,I'M NOT JUDGING,I'M ASSESSING
ST20240527_202546_NO EXCUSES JUST RESULTS,NO EXCUSES,JUST RESULTS
ST20240527_202547_ITS ONLY ILLEGAL IF YOU GET CAUGHT,IT'S ONLY ILLEGAL,IF YOU GET CAUGHT
ST20240527_202548_PAIN IS INEVITABLE SUFFERING IS OPTIONAL,"PAIN IS INEVITABLE,",SUFFERING IS OPTIONAL
ST20240527_202549_DEBATE TEAM WE HAVE ISSUES,DEBATE TEAM WE,HAVE ISSUES
ST20240527_202550_SORRY FOR DRIVING THE SPEED LIMIT SOME OF US HAVE WARRANTS,SORRY FOR DRIVING THE SPEED,LIMIT SOME OF US HAVE WARRANTS!
ST20240527_202551_WORLDS OKAYEST PHOTOGRAPHER,WORLD'S OKAYEST,PHOTOGRAPHER
ST20240527_202552_HERES LOOKING AT YOU KID,HERE'S LOOKING,"AT YOU, KID."
ST20240527_202553_WATCH OUT FOR THE IDIOT BEHIND ME,WATCH OUT FOR THE,IDIOT BEHIND ME
ST20240527_202554_YOUR HOLES IS MY GOAL,YOUR HOLES,IS MY GOAL
ST20240527_202555_HAPPINESS IS NOT A DESTINATION IT IS A WAY OF LIFE,HAPPINESS IS NOT A,DESTINATION IT IS A WAY OF LIFE
ST20240527_202556_TAKE CHANCES MAKE MISTAKES GET MESSY,"TAKE CHANCES, MAKE","MISTAKES, GET MESSY"
ST20240527_202557_THE REVOLUTION WILL NOT BE TELEVISED,THE REVOLUTION WILL,NOT BE TELEVISED
ST20240527_202558_MY CAT AND I TALK SHIT ABOUT YOU,MY CAT AND I TALK,SHIT ABOUT YOU
ST20240527_202559_MY DOG AND I TALK SHIT ABOUT YOU,MY DOG AND I TALK,SHIT ABOUT YOU
ST20240527_202600_DONT LET THE CAT OUT,DON'T LET,THE CAT OUT
ST20240527_202601_DONT TELL ME WHAT TO DO YOURE NOT MY CAT,DON'T TELL ME WHAT TO,"DO, YOU'RE NOT MY CAT"
ST20240527_202602_YOU DID NOTWAKE UP TODAY TO BE A WEAK ASS BITCH,"YOU DID NOT,WAKE UP TODAY",TO BE A WEAK ASS BITCH
ST20240527_202603_YOU DID NOT WAKE UP TODAY TO BE MEDIOCRE,YOU DID NOT WAKE UP,TODAY TO BE MEDIOCRE
ST20240527_202604_SORRY IM LATE I WAS POOPING,SORRY I'M LATE I,WAS POOPING
ST20240527_202605_IM NOT LAZY I JUST DONT CARE,I'M NOT LAZY I,JUST DON'T CARE
ST20240527_202606_WHERE WERE YOU NOW,WHERE WERE,YOU NOW
ST20240527_202607_DONT LET THE HARD DAYS WIN,DON'T LET THE,HARD DAYS WIN.
ST20240527_202608_JESUS LOVES YOU BUT IM HIS FAVORITE,"JESUS LOVES YOU, BUT",I'M HIS FAVORITE
ST20240527_202609_SLOW IS SMOOTH SMOOTH IS FAST,"SLOW IS SMOOTH,",SMOOTH IS FAST
ST20240527_202610_SORRY IM LATE I TOOK THE RHOMBUS,SORRY I'M LATE I,TOOK THE RHOMBUS
ST20240527_202611_AND SHE LIVED HAPPILY EVER AFTER,AND SHE LIVED,HAPPILY EVER AFTER!
ST20240527_202612_BLOOM WHERE YOU ARE PLANTED,BLOOM WHERE YOU,ARE PLANTED
ST20240527_202613_TREAT PEOPLE WITH KINDNESS,TREAT PEOPLE,WITH KINDNESS
ST20240527_202614_I DIDNT GO THROUGH ALL THAT FOR NOTHING,I DIDN'T GO THROUGH,ALL THAT FOR NOTHING
ST20240527_202615_JUST A BOY WHO LOVES MINING,JUST A BOY WHO,LOVES MINING
ST20240527_202616_TODAY I WILL BE POSITIVE,TODAY I WILL,BE POSITIVE
ST20240527_202617_HONK IF YOU LOVE GOOSE,HONK IF YOU,LOVE GOOSE!
ST20240527_202618_PLEASE BE PATIENT I AM SO STUPID,PLEASE BE PATIENT,I AM SO STUPID
ST20240527_202619_JUST A GIRL WHO LOVES BUNNYS,JUST A GIRL WHO,LOVES BUNNYS
ST20240527_202620_DONT MAKE ME USE MY EPIDEMIOLOGIST VOICE,DON'T MAKE ME USE MY,EPIDEMIOLOGIST VOICE
ST20240527_202621_DONT MAKE ME USE MY COACH VOICE,DON'T MAKE ME USE,MY COACH VOICE
ST20240527_202622_I HOPE YOUR DAY IS AS NICE AS MY BUTT,I HOPE YOUR DAY IS,AS NICE AS MY BUTT
ST20240527_202623_MONEY IS JUST PAPER,MONEY IS,JUST PAPER.
ST20240527_202624_EMOTIONALLY ATTACHED TO FICTIONAL CHARACTERS,EMOTIONALLY ATTACHED TO,FICTIONAL CHARACTERS
ST20240527_202625_I FIND YOUR LACK OF FAITH DISTURBING,I FIND YOUR LACK OF,FAITH DISTURBING
ST20240527_202626_WORLDS OKAYEST BRAWLER,WORLD'S,OKAYEST BRAWLER
ST20240527_202627_THIS TINY TURTLE HE JUDGES YOU IMMENSELY,THIS TINY TURTLE HE,JUDGES YOU IMMENSELY
